{
  "$schema": "https://json-schema.org/draft/2020-12/schema",
  "$id": "https://github.com/jeremylongshore/intent-eval-core/schemas/v1/usage-event.schema.json",
  "title": "UsageEvent — append-only product-metering ledger row (15th canonical entity, DR-103 D1)",
  "description": "The 15th canonical entity. Append-only product-metering LEDGER, DISTINCT from CostRecord: CostRecord (§ 2.12) attributes PROVIDER SPEND (money in micro-USD + tokens); UsageEvent meters PRODUCT-METER COUNTS in BUSINESS UNITS (`meter` + `quantity` + `unit`). The nullable `cost_record_ref` back-reference is the SEAM proving they are SEPARATE tables — a metering row MAY cite the CostRecord that priced the same action, but the two are independently authored and never merged. Single terminal state `recorded`; the row is immutable at creation and corrections are NEW rows, never mutation (append-only). ANTI-GAMING (DR-103 D1 B1.2, machine-enforced): every metered (non-`api_call`) row MUST bind to a VERIFIED gated source — non-null `source_entity_type` + `source_entity_id` AND `source_verified === true` (the marker the runtime sets ONLY after the source session clears its quality gate) — so an arbitrary hand-supplied `quantity` with no verified provenance is refused; enforced here via `allOf`/`if-then`, in Zod via `.superRefine`, and in Pydantic via `model_validator` (one rule, three layers). The spec's original \"ZERO hand-validators needed\" claim is DELETED. C3 (DR-103 C3 B6.1): the `meter` enum is HETEROGENEOUS and the `unit` is mixed across meters; a consumer MUST NOT SUM/aggregate `quantity` across distinct `(meter, unit)` pairs into one scalar — rollups are per-`(meter, unit)` vectors only, enforced structurally (there is no rolled-total field on the row by construction). `quantity` is a COUNTED action, NEVER an assigned utility/weight/score (DR-103 epic Rule 1). FREEZE discipline (DR-103 binding constraint 1): the `meter` enum AND the entity name FREEZE at the first production-Rekor signature (NONE in this PR); until then both stay malleable. CMO dissent preserved (`usage_events` is a billing name) — the rename-before-production-sign debt is bound in DR-103. ADDITIVE / one-way-door: this shape ships in signed @intentsolutions/core entries, so widening or merging it post-publish is irreversible — additive only. `tenant_id` is OPTIONAL-NOT-NULLABLE (DR-103 D2 / deferral-G, bd_000-projects-k0fj), byte-identical to EvalSpec/EvalRun/SkillSnapshot/SkillVersion. A UsageEvent rides INSIDE the `extensions` field of an EvidenceStatement; it does NOT become a gate-result/v1 statement. NO production-Rekor signing is wired here.",
  "$comment": "DR-103 D1 B1.2 anti-gaming cross-field invariant is machine-enforced at all three layers: this JSON-Schema `allOf`/`if-then`, the Zod `.superRefine` in src/validators/v1/usage-event.ts, and the Pydantic `model_validator` wrapper in python/.../models.py. The invariant: meter != 'api_call' (a metered row) ⇒ source_entity_type non-null AND source_entity_id non-null AND source_verified === true. `dashboard_render` is intentionally ABSENT from the `meter` + `source_entity_type` enums (DR-103 D1 B1.4 / spec §5 risk 1): a dashboard render is a PREDICATE BODY (`dashboard-render/v1`), not a lifecycle metering entity.",
  "type": "object",
  "additionalProperties": false,
  "required": [
    "id",
    "meter",
    "quantity",
    "unit",
    "source_entity_type",
    "source_entity_id",
    "source_verified",
    "cost_record_ref",
    "recorded_at"
  ],
  "properties": {
    "id": {
      "$ref": "_common.schema.json#/$defs/uuidv7",
      "description": "UUIDv7 PK."
    },
    "meter": {
      "type": "string",
      "enum": [
        "api_call",
        "eval_run",
        "skill_invocation",
        "judge_decision",
        "gate_evaluation",
        "report_render"
      ],
      "description": "The metered PRODUCT-METER dimension. CLOSED pricing enum (DR-103 D1 B1.4, safest for billing). HETEROGENEOUS — distinct meters carry distinct `unit`s and MUST NOT be cross-summed (C3). FREEZES at the first production-Rekor signature; widening after is a /v2 trigger. `dashboard_render` is intentionally absent (a predicate body, not a lifecycle entity). `api_call` is the ONLY meter exempt from the verified-source binding (the leaf action has no gated parent session)."
    },
    "quantity": {
      "type": "integer",
      "minimum": 0,
      "description": "The metered count, expressed in `unit`. A non-negative COUNT of a verified action — NEVER an assigned utility/weight/score (DR-103 epic Rule 1). Any derived value is computed downstream from the ledger at read time, never stored on the row."
    },
    "unit": {
      "type": "string",
      "enum": ["count", "tokens", "seconds", "bytes"],
      "description": "The business unit `quantity` is expressed in. MIXED across meters — a `tokens` count and a `count` are NON-COMPARABLE, which is exactly why a cross-`(meter, unit)` SUM is out of contract (C3)."
    },
    "source_entity_type": {
      "oneOf": [
        {
          "type": "string",
          "enum": [
            "eval_run",
            "session_trace",
            "judge_decision",
            "tool_invocation",
            "skill_version"
          ]
        },
        { "type": "null" }
      ],
      "description": "The gated entity TYPE this row meters. Non-null for every metered (non-`api_call`) row (anti-gaming, DR-103 D1 B1.2, enforced in the allOf/if-then below); `null` permitted ONLY for `meter === 'api_call'`."
    },
    "source_entity_id": {
      "oneOf": [{ "$ref": "_common.schema.json#/$defs/uuidv7" }, { "type": "null" }],
      "description": "Reference (UUIDv7) to the gated source entity. Non-null for every metered (non-`api_call`) row (anti-gaming); `null` only for `api_call`. A content/identity reference, NOT an enforced relational FK — the kernel persists nothing."
    },
    "source_verified": {
      "type": "boolean",
      "description": "The verified marker — `true` iff the runtime confirmed the source session cleared its quality gate. MUST be `true` for every metered (non-`api_call`) row (anti-gaming, DR-103 D1 B1.2): a metered row with an unverified source is REFUSED. The runtime sets this; a developer never hand-authors `true` (DR-103 D1 B1.6 honest-emit-path binding). For `api_call` it MAY be `false`."
    },
    "cost_record_ref": {
      "oneOf": [{ "$ref": "_common.schema.json#/$defs/uuidv7" }, { "type": "null" }],
      "description": "NULLABLE back-reference to the CostRecord that priced the SAME action — the SEAM proving UsageEvent and CostRecord are SEPARATE tables (DR-103 D1). `null` in the common case (most metered actions are not provider-priced). A reference, NOT an enforced relational FK."
    },
    "recorded_at": { "$ref": "_common.schema.json#/$defs/rfc3339" },
    "tenant_id": {
      "$ref": "_common.schema.json#/$defs/uuidv7",
      "description": "RESERVED multi-tenancy slot (DR-085 D5 / deferral-G, bd_000-projects-k0fj), byte-identical to EvalSpec/EvalRun/SkillSnapshot/SkillVersion. OPTIONAL + NOT NULLABLE — omitted from `required`; an explicit `null` is rejected (the schema $ref's uuidv7 with no null branch). A present tenant_id is an attested tenant claim; an absent one is single-tenant/global and MUST NOT be pooled into a cross-tenant aggregate (DR-103 D2 B2.2). Tenant-isolation semantics deferred to a future DR; v1 single-tenant rows omit it."
    }
  },
  "allOf": [
    {
      "$comment": "DR-103 D1 B1.2 anti-gaming: a metered row (meter != 'api_call') MUST bind to a verified gated source. Branch 1 — source_entity_type MUST be a non-null enum member.",
      "if": {
        "properties": { "meter": { "not": { "const": "api_call" } } },
        "required": ["meter"]
      },
      "then": {
        "properties": {
          "source_entity_type": {
            "type": "string",
            "enum": [
              "eval_run",
              "session_trace",
              "judge_decision",
              "tool_invocation",
              "skill_version"
            ]
          }
        },
        "required": ["source_entity_type"]
      }
    },
    {
      "$comment": "DR-103 D1 B1.2 anti-gaming: Branch 2 — source_entity_id MUST be a non-null UUIDv7 for a metered row.",
      "if": {
        "properties": { "meter": { "not": { "const": "api_call" } } },
        "required": ["meter"]
      },
      "then": {
        "properties": {
          "source_entity_id": { "$ref": "_common.schema.json#/$defs/uuidv7" }
        },
        "required": ["source_entity_id"]
      }
    },
    {
      "$comment": "DR-103 D1 B1.2 anti-gaming: Branch 3 — source_verified MUST be exactly true for a metered row (no metered count without verified provenance).",
      "if": {
        "properties": { "meter": { "not": { "const": "api_call" } } },
        "required": ["meter"]
      },
      "then": {
        "properties": {
          "source_verified": { "const": true }
        },
        "required": ["source_verified"]
      }
    }
  ]
}
